{
	"$id": "https://raw.githubusercontent.com/carmada-dev/demo-images/main/_schemas/image.scheam.json",
	"$schema": "https://json-schema.org/draft/2020-12/schema",


	"$defs":{
		"gallery": {
			"type": "object",
			"description": "The target gallery to upload the image",
			"properties": {
				"subscription": {
					"$ref": "./_definitions.schema.json#/$defs/guid",
					"description": "The subscription ID of the gallery"
				},
				"resourceGroup": {
					"type": "string",
					"description": "The resource group of the gallery"
				},
				"name": {
					"type": "string",
					"description": "The gallery resource name"
				}
			},
			"required": [ "subscription", "resourceGroup", "name" ],
			"additionalProperties": false
		},
		"archive": {
			"type": "object",
			"description": "The target archive to upload the image in VHDX format",
			"properties": {
				"subscription": {
					"$ref": "./_definitions.schema.json#/$defs/guid",
					"description": "The subscription ID of the archive"
				},
				"resourceGroup": {
					"type": "string",
					"description": "The resource group of the archive"
				},
				"name": {
					"type": "string",
					"description": "The archive storage account resource name",
					"default": ""
				}				
			},
			"required": [ "subscription", "resourceGroup", "name" ],
			"additionalProperties": false
		},
		"devCenter": {
			"type": "object",
			"description": "The target dev center to create a DevBox Definition in",
			"properties": {
				"subscription": {
					"$ref": "./_definitions.schema.json#/$defs/guid",
					"description": "The subscription ID of the dev center"
				},
				"resourceGroup": {
					"type": "string",
					"description": "The resource group of the dev center"
				},
				"name": {
					"type": "string",
					"description": "The dev center resource name"
				},
				"storage": {
					"type": "string",
					"description": "The storage size to use for the DevBox Definition"
				},
				"compute": {
					"type": "string",
					"description": "The compute size to use for the DevBox Definition"
				}
			},
			"required": [ "subscription", "resourceGroup", "name", "storage", "compute" ],
			"additionalProperties": false
		},
		"devDrive": {
			"type": "object",
			"description": "Create a DevDrive inside the image",
			"properties": {
				"sizeGB": {
					"type": "integer",
					"description": "The size of the dev drive in GB (minimum 5GB) - set to 0 to disable DevDrive",
					"minimum": 0,
					"default": 0
				},
				"filters": {
					"type": "array",
					"description": "Filters to apply to the DevDrive",
					"default": [
						"bindFlt",
						"wcifs",
						"PrjFlt",
						"MsSecFlt",
						"WdFilter",
						"FileInfo",
						"ProcMon24",
						"WinSetupMon"
					],
					"items": {
						"type": "string",
						"description": "The name of a filter to apply"
					}
				},
				"repositories": {
					"type": "array",
					"description": "List of repositories to clone into the DevDrive",
					"default": [],
					"items": {
						"type": "object",
						"properties": {
							"repoUrl": {
								"type": "string",
								"description": "The URL of the repository"
							},
							"tokenUrl": {
								"type": "string",
								"description": "An Azure KeyVault secret URL containing the token to access the repository"
							}
						},
						"required": [ "repoUrl" ],
						"additionalProperties": false
					}
				}
			},
			"required": [ "sizeGB", "filters", "repositories" ],
			"additionalProperties": false		
		}
	},


	"title": "Image",
	"description": "DevBox image definition",
	"type": "object",
	"properties": {
		"publisher": {
			"type": "string",
			"description": "The publisher of the image"
		},
		"offer": {
			"type": "string",
			"description": "The offer of the image"
		},
		"sku": {
			"type": "string",
			"description": "The SKU of the image"
		},
		"regions": {
			"type": "array",
			"description": "The regions where the image is available",
			"items": {
				"type": "string"
			}
		},
		"updates": {
			"type": "string",
			"description": "Windows updates that should be installed on the image",
			"enum": [ "all", "none", "recommended", "important" ],
			"default": "all"
		},
		"base": {
			"type": "object",
			"description": "The base image",
			"properties": {
				"publisher": {
					"type": "string",
					"description": "The publisher of the base image"
				},
				"offer": {
					"type": "string",
					"description": "The offer of the base image"
				},
				"sku": {
					"type": "string",
					"description": "The SKU of the base image"
				},
				"version": {
					"type": "string",
					"description": "The version of the base image",
					"default": "latest"
				}
			},
			"required": [ "publisher", "offer", "sku", "version" ],
			"additionalProperties": false
		},
		"gallery": {
			"type": "object",
			"$ref": "#/$defs/gallery"
		},
		"archive": {
			"type": "object",
			"$ref": "#/$defs/archive"
		},
		"devCenter": {
			"type": "object",
			"$ref": "#/$defs/devCenter"
		},
		"devDrive": {
			"type": "object",
			"$ref": "#/$defs/devDrive"
		},
		"features": {
			"type": "array",
			"description": "List of features to enable in the image",
			"default": [],
			"items": {
				"type": "string"
			}
		},
		"prepare": {
			"type": "array",
			"description": "List of scripts to run to prepare the image before installing packages",
			"default": [],
			"items": {
				"type": "string"
			}
		},
		"packages": {
			"type": "array",
			"description": "List of packages to install in the image",
			"default": [],
			"items": {				
				"oneOf": [
					{
						"$ref": "./_definitions.schema.json#/$defs/package"
					},
					{
						"$ref": "./_definitions.schema.json#/$defs/packageRef"
					}
				]
			}
		},
		"configure": {
			"type": "array",
			"description": "List of scripts to run to configure the image after installing packages",
			"default": [],
			"items": {
				"type": "string"
			}
		}
	}
}