{
	"$schema": "../_schemas/image.schema.json",
	"publisher": "CarmadaRnD",
	"offer": "CarmadaDev",
	"sku": "win11-mobile-devbox",
	"regions": [ "West Europe" ],
	"updates": "all",

	"base": {
		"publisher": "MicrosoftVisualStudio",
		"offer": "windowsplustools",
		"sku": "base-win11-gen2",
		"version": "latest"
	},
	
	"gallery": {
		"subscription": "f9fcf631-fa8d-4ea2-8298-61b43220a3d1",
		"resourceGroup": "ORG-CarmadaRnD",
		"name": "CarmadaRnD"
	},
	
	"archive": {
		"subscription": "f9fcf631-fa8d-4ea2-8298-61b43220a3d1",
		"resourceGroup": "ORG-CarmadaRnD",
		"name": ""
	},
	
	"devCenter": {
		"subscription": "f9fcf631-fa8d-4ea2-8298-61b43220a3d1",
		"resourceGroup": "ORG-CarmadaRnD",
		"name": "CarmadaRnD",
		"compute": "general_i_8c32gb1024ssd_v2",
		"storage": "ssd_1024gb"
	},
	
	"devDrive": {
		"sizeGB": 0,
		"filters": [],
		"repositories": []
	},

	"features": [

	],

	"prepare": [

	],

	"packages": [
		{
			"name": "dockerDesktopWSL",
			"source": "alias"
		},
		{
			"name": "vscode",
			"source": "alias"			
		},
		{
			"name": "Microsoft.VisualStudio.2022.Enterprise",
			"scope": "machine",
			"override": [
				"--add Microsoft.VisualStudio.Workload.CoreEditor", 
				"--add Microsoft.VisualStudio.Workload.NetCrossPlat",
				"--includeRecommended",
				"--includeOptional",
				"--installWhileDownloading",
				"--quiet",
				"--norestart",
				"--force",
				"--wait",
				"--nocache"
			]
		},
		{
			"name": "Google.AndroidStudio",
			"scope": "machine"
		},
		{
			"name": "Wondershare.MirrorGo",
			"scope": "machine"
		},
		{
			"name": "git",
			"source": "alias"
		},
		{
			"name": "GitHub.cli",
			"scope": "machine"
		},
		{
			"name": "GitHub.GitHubDesktop",
			"scope": "machine"
		},
		{
			"name": "Postman.Postman",
			"scope": "user"
		},
		{
			"name": "Microsoft.Azure.StorageExplorer",
			"scope": "machine"
		},
		{
			"name": "Google.Chrome",
			"scope": "machine"
		},
		{
			"name": "Mozilla.Firefox",
			"scope": "machine"
		}
	],

	"configure": [

	]
}