{
	"$schema": "../_schemas/image.schema.json",
	"publisher": "CarmadaRnD",
	"offer": "CarmadaDev",
	"sku": "win11-sitecore-devbox",
	"regions": [ "West Europe" ],
	"updates": "all",

	"base": {
		"publisher": "MicrosoftVisualStudio",
		"offer": "windowsplustools",
		"sku": "base-win11-gen2",
		"version": "latest"
	},
	
	"gallery": {
		"subscription": "f9fcf631-fa8d-4ea2-8298-61b43220a3d1",
		"resourceGroup": "ORG-CarmadaRnD",
		"name": "CarmadaRnD"
	},
	
	"archive": {
		"subscription": "bffe1654-7f9a-4630-b7b9-d24759a76222",
		"resourceGroup": "BLD-Carmada",
		"name": "carmada"
	},
	
	"devCenter": {
		"subscription": "f9fcf631-fa8d-4ea2-8298-61b43220a3d1",
		"resourceGroup": "ORG-CarmadaRnD",
		"name": "CarmadaRnD",
		"compute": "general_i_8c32gb1024ssd_v2",
		"storage": "ssd_1024gb"
	},
	
	"devDrive": {
		"sizeGB": 0,
		"filters": [],
		"repositories": []
	},

	"features": [

	],

	"prepare": [
		"[IMAGEROOT]/../_scripts/Prepare-Sitecore.ps1"
	],

	"packages": [
		{
			"name": "dockerDesktopWSL",
			"source": "alias"
		}
	],

	"configure": [
		
	]
}